Texas Health Center For Diagnostics & Surgery Plano,450891,TX,35111,33735,35155,34548,36207,37425,0,36388,34557,34989,34942,TEXAS HEALTH CENTER FOR DIAGNOSTICS AND SURGERY PLANO,32096.090909090908,10,TEXAS HEALTH CENTER FOR DIAGNOSTICS & SURGERY PLAN,TX,PLANO,,TEXAS HEALTH CENTER FOR DIAGNOSTICS AND SURGERY PLAN,CCN,,No,,Texas Health Hospital Frisco,60.0,Fuzzy name
Thhbp Management Company Llc,450893,TX,12230,12230,12230,12230,12230,12230,12230,12230,12230,12230,12230,THHBP MANAGEMENT COMPANY LLC,12230.0,11,THE HEART HOSPITAL BAYLOR DENTON,TX,DENTON,5.0,HEART HOSPITAL BAYLOR DENTON,CCN,,No,,LEGENT ORTHOPEDIC HOSPITAL,48.1,Fuzzy name
Parmer county community hospital,451300,TX,0,0,0,0,0,0,0,0,0,0,0,PARMER COUNTY COMMUNITY HOSPITAL,0.0,0,PARMER COUNTY COMMUNITY HOSPITAL,TX,FRIONA,,PARMER COUNTY COMMUNITY HOSPITAL,CCN,,No,,Methodist Southlake Hospital,60.0,Fuzzy name
Muenster memorial hospital,451335,TX,0,0,0,0,0,0,0,0,0,0,0,MUENSTER MEMORIAL HOSPITAL,0.0,0,MUENSTER MEMORIAL HOSPITAL,TX,MUENSTER,,MUENSTER MEMORIAL HOSPITAL,CCN,,No,,Midland Memorial Hospital,81.0,Fuzzy name
Throckmorton County Memorial Hosp,451339,TX,4287,4144,4343,4330,4309,4521,3851,4415,4075,3988,3857,THROCKMORTON COUNTY MEMORIAL HOSP,4192.727272727273,11,THROCKMORTON COUNTY MEMORIAL HOSPITAL,TX,THROCKMORTON,,THROCKMORTON COUNTY MEMORIAL HOSPITAL,CCN,,No,,TX Health Arlington Memorial Hosp,60.6,Fuzzy name
Golden plains community hospital,451369,TX,6237,5992,6244,6137,6431,6648,6107,6464,6138,6215,6207,GOLDEN PLAINS COMMUNITY HOSPITAL,6256.363636363636,11,GOLDEN PLAINS COMMUNITY HOSPITAL,TX,BORGER,,GOLDEN PLAINS COMMUNITY HOSPITAL,CCN,,No,,Midland Memorial Hospital,59.6,Fuzzy name
Texas Health Specialty Hospital Forth Worth,452018,TX,0,0,0,0,0,0,0,0,0,0,0,TEXAS HEALTH SPECIALTY HOSPITAL FORTH WORTH,0.0,0,,,,,,No match,85.7,Review,BDC,Texas Health Hospital Frisco,85.7,Fuzzy name
Select Specialty Hospital- Dallas,452022,TX,0,0,0,0,0,0,0,0,0,0,0,SELECT SPECIALTY HOSPITAL DALLAS,0.0,0,,,,,,No match,80.0,No,,Legent Hospital for Special Sx,67.7,Fuzzy name
Kindred Hospital Tarrant County,452028,TX,0,0,0,0,0,0,0,0,0,0,0,KINDRED HOSPITAL TARRANT COUNTY,0.0,0,,,,,,No match,85.7,No,,DOCTORS HOSPITAL AT RENAISSANCE,57.6,Fuzzy name
Continuecare Hospital At Hendrick Medical Center,452029,TX,5642,8175,10856,5932,8230,11035,7539,13669,10165,16918,18958,CONTINUECARE HOSPITAL HENDRICK MED CTR,10647.181818181818,11,MEDICAL CENTER HOSPITAL,TX,ODESSA,3.0,MED CTR HOSPITAL,Exact/fuzzy hospital name,100.0,Yes,BDC+,HENDRICK MEDICAL CENTER,100.0,Fuzzy name
Cornerstone Specialty Hospitals Clear Lake,452032,TX,0,0,0,0,0,0,0,0,0,0,0,CORNERSTONE SPECIALTY HOSPITALS CLEAR LAKE,0.0,0,,,,,,No match,70.5,No,,Legent Hospital for Special Sx,61.1,Fuzzy name
Texas Neurorehab Center,452038,TX,0,0,0,0,0,0,0,0,0,0,0,TEXAS NEUROREHAB CENTER,0.0,0,,,,,,No match,68.6,No,,Texoma Medical Center,54.1,Fuzzy name
Carrus Specialty Hospital,452041,TX,0,0,0,0,0,0,0,0,0,0,0,CARRUS SPECIALTY HOSPITAL,0.0,0,,,,,,No match,83.7,No,,Legent Hospital for Special Sx,65.5,Fuzzy name
Christus Dubuis Hospital Of Beaumont,452042,TX,0,0,0,0,0,0,0,0,0,0,0,CHRISTUS DUBUIS HOSPITAL BEAUMONT,0.0,0,,,,,,No match,81.0,No,,HOUSTON METHODIST WEST HOSPITAL,59.4,Fuzzy name
Lifecare Hospitals Of North Texas,452044,TX,0,0,0,0,0,0,0,0,0,0,0,LIFECARE HOSPITALS NORTH TEXAS,0.0,0,,,,,,No match,82.1,No,,TEXAS ORTHOPEDIC HOSPITAL,69.1,Fuzzy name
Cornerstone Specialty Hospitals Houston Medical Center,452046,TX,0,0,0,0,0,0,0,0,0,0,0,CORNERSTONE SPECIALTY HOSPITALS HOUSTON MED CTR,0.0,0,,,,,,No match,90.9,No,,Texoma Medical Center,66.7,Fuzzy name
Ut Health East Texas Long Term Acute Care,452051,TX,0,0,0,0,0,0,0,0,0,0,0,UT HEALTH EAST TEXAS LONG TERM ACUTE CARE,0.0,0,,,,,,No match,72.9,No,,Texas Health Hospital Frisco,60.0,Fuzzy name
Pam Specialty Hospital Of Victoria South,452056,TX,0,0,0,0,0,0,0,0,0,0,0,PAM SPECIALTY HOSPITAL VICTORIA SOUTH,0.0,0,,,,,,No match,80.0,No,,Legent Hospital for Special Sx,59.7,Fuzzy name
"Nexus Specialty Hospital - The Woodlands, Ltd.",452057,TX,0,0,0,0,0,0,0,0,0,0,0,NEXUS SPECIALTY HOSPITAL WOODLANDS LTD,0.0,0,THE WOODLANDS SPECIALTY HOSPITAL,TX,SPRING,,WOODLANDS SPECIALTY HOSPITAL,Exact/fuzzy hospital name,100.0,No,,Chi St Lukes The Woodlands Hsptl,66.7,Fuzzy name
Pam Specialty Hospital Of San Antonio Medical Center,452059,TX,0,0,0,0,0,0,0,0,0,0,0,PAM SPECIALTY HOSPITAL SAN ANTONIO MED CTR,0.0,0,MEDICAL CENTER HOSPITAL,TX,ODESSA,3.0,MED CTR HOSPITAL,Exact/fuzzy hospital name,100.0,No,,Texoma Medical Center,66.7,Fuzzy name
Pam Specialty Hospital Of Texarkana North,452061,TX,0,0,0,0,0,0,0,0,0,0,0,PAM SPECIALTY HOSPITAL TEXARKANA NORTH,0.0,0,,,,,,No match,80.0,No,,NORTH CENTRAL BAPTIST HOSPITAL,67.6,Fuzzy name
Kpc Promise Hospital Of Dallas Llc,452067,TX,0,0,0,0,0,0,0,0,0,0,0,KPC PROMISE HOSPITAL DALLAS LLC,0.0,0,,,,,,No match,80.0,No,,PHYSICIANS SURGICAL HOSPITALS LLC,56.2,Fuzzy name
Kpc Promise Hospital Of Wichita Falls Llc,452068,TX,0,0,0,0,0,0,0,0,0,0,0,KPC PROMISE HOSPITAL WICHITA FALLS LLC,0.0,0,,,,,,No match,80.0,No,,PHYSICIANS SURGICAL HOSPITALS LLC,59.2,Fuzzy name
Kindred Hospital - San Antonio Central,452073,TX,0,0,0,0,0,0,0,0,0,0,0,KINDRED HOSPITAL SAN ANTONIO CENTRAL,0.0,0,,,,,,No match,80.0,No,,NORTH CENTRAL BAPTIST HOSPITAL,69.7,Fuzzy name
Kindred Hospital Clear Lake,452075,TX,0,0,0,0,0,0,0,0,0,0,0,KINDRED HOSPITAL CLEAR LAKE,0.0,0,,,,,,No match,82.6,No,,Midland Memorial Hospital,61.5,Fuzzy name
Kindred Hospital El Paso,452079,TX,0,0,0,0,0,0,0,0,0,0,0,KINDRED HOSPITAL EL PASO,0.0,0,,,,,,No match,82.4,No,,Midland Memorial Hospital,61.2,Fuzzy name
Pam Specialty Hospital Of Corpus Christi North,452086,TX,0,0,0,0,0,0,0,0,0,0,0,PAM SPECIALTY HOSPITAL CORPUS CHRISTI NORTH,0.0,0,,,,,,No match,80.0,No,,NORTH CENTRAL BAPTIST HOSPITAL,63.6,Fuzzy name
Select Specialty Hospital Longview,452087,TX,0,0,0,0,0,0,0,0,0,0,0,SELECT SPECIALTY HOSPITAL LONGVIEW,0.0,0,,,,,,No match,80.0,No,,Legent Hospital for Special Sx,68.8,Fuzzy name
Pam Specialty Hospital Of San Antonio,452090,TX,0,0,0,0,0,0,0,0,0,0,0,PAM SPECIALTY HOSPITAL SAN ANTONIO,0.0,0,,,,,,No match,80.0,No,,Legent Hospital for Special Sx,62.5,Fuzzy name
Tyler Continuecare Hospital,452091,TX,0,0,0,0,0,0,0,0,0,0,0,TYLER CONTINUECARE HOSPITAL,0.0,0,,,,,,No match,80.0,No,,TEXAS ORTHOPEDIC HOSPITAL,61.5,Fuzzy name
Solara Specialty Hospitals Mcallen,452095,TX,0,0,0,0,0,0,0,0,0,0,0,SOLARA SPECIALTY HOSPITALS MCALLEN,0.0,0,,,,,,No match,72.7,No,,Legent Hospital for Special Sx,62.5,Fuzzy name
Laredo Specialty Hospital,452096,TX,0,0,0,0,0,0,0,0,0,0,0,LAREDO SPECIALTY HOSPITAL,0.0,0,,,,,,No match,83.7,No,,Legent Hospital for Special Sx,69.1,Fuzzy name
Vibra Specialty Hospital,452097,TX,0,0,0,0,0,0,0,0,0,0,0,VIBRA SPECIALTY HOSPITAL,0.0,0,,,,,,No match,85.7,No,,Midland Memorial Hospital,65.3,Fuzzy name
Mesquite Specialty Hospital,452100,TX,0,0,0,0,0,0,0,0,0,0,0,MESQUITE SPECIALTY HOSPITAL,0.0,0,,,,,,No match,80.0,No,,Legent Hospital for Special Sx,66.7,Fuzzy name
Solara Specialty Hospitals Harlingen,452101,TX,0,0,0,0,0,0,0,0,0,0,0,SOLARA SPECIALTY HOSPITALS HARLINGEN,0.0,0,,,,,,No match,69.2,No,,USMD Hospital at Arlington LP,64.5,Fuzzy name
Covenant Specialty Hospital,452102,TX,0,0,0,0,0,0,0,0,0,0,0,COVENANT SPECIALTY HOSPITAL,0.0,0,,,,,,No match,80.0,No,,Legent Hospital for Special Sx,73.7,Fuzzy name
Baylor Scott & White Continuing Care Hospital,452105,TX,0,0,0,0,0,0,0,0,0,0,0,BAYLOR SCOTT AND WHITE CONTINUING CARE HOSPITAL,0.0,0,,,,,,No match,88.6,No,,BS&W TEXAS SPINE & JOINT HOSPITAL,58.5,Fuzzy name
Cornerstone Specialty Hospitals Conroe,452107,TX,0,0,0,0,0,0,0,0,0,0,0,CORNERSTONE SPECIALTY HOSPITALS CONROE,0.0,0,,,,,,No match,74.6,No,,PHYSICIANS SURGICAL HOSPITALS LLC,56.3,Fuzzy name
Horizon Medical Center Of Denton,452111,TX,0,0,0,0,0,0,0,0,0,0,0,HORIZON MED CTR DENTON,0.0,0,,,,,,No match,73.7,No,,EMINENT MEDICAL CENTER OPERATING,68.1,Fuzzy name
Houston Methodist Continuing Care Hospital,452118,TX,0,0,0,0,0,0,0,0,0,0,0,HOUSTON METHODIST CONTINUING CARE HOSPITAL,0.0,0,HOUSTON METHODIST HOSPITAL,TX,HOUSTON,5.0,HOUSTON METHODIST HOSPITAL,Exact/fuzzy hospital name,100.0,Yes,BDC,HOUSTON METHODIST HOSPITAL,100.0,Fuzzy name
Continuecare Hospital At Medical Center Odessa,452121,TX,0,0,0,0,0,0,0,0,0,0,0,CONTINUECARE HOSPITAL MED CTR ODESSA,0.0,0,MEDICAL CENTER HOSPITAL,TX,ODESSA,3.0,MED CTR HOSPITAL,Exact/fuzzy hospital name,100.0,No,,Texoma Medical Center,66.7,Fuzzy name
El Paso Ltac Hospital,452122,TX,0,0,0,0,0,0,0,0,0,0,0,EL PASO LTAC HOSPITAL,0.0,0,,,,,,No match,86.5,No,,Legent Hospital for Special Sx,62.7,Fuzzy name
Tirr Memorial Hermann,453025,TX,19428,18666,19452,19116,20034,20708,19023,20134,19121,19360,19334,TIRR MEMORIAL HERMANN,19488.727272727272,11,MEMORIAL HERMANN HOSPITAL SYSTEM,TX,HOUSTON,3.0,MEMORIAL HERMANN,Exact/fuzzy hospital name,100.0,Review,BDC,MEMORIAL HERMANN SW HOSPITAL,86.5,Fuzzy name
Encompass Health Rehabilitation Hospital Of Humble,453029,TX,0,0,0,0,0,0,0,0,0,0,0,ENCOMPASS HEALTH REHABILITATION HOSPITAL HUMBLE,0.0,0,,,,,,No match,80.0,No,,Texas Health Hospital Frisco,69.8,Fuzzy name
Encompass Health Rehabilitation Hospital Of San Antonio,453031,TX,0,0,0,0,0,0,0,0,0,0,0,ENCOMPASS HEALTH REHABILITATION HOSPITAL SAN ANTONIO,0.0,0,,,,,,No match,80.0,No,,Texas Health Hospital Frisco,69.8,Fuzzy name
Warm Springs Rehabilitation Hospital Of San Antonio,453035,TX,0,0,0,0,0,0,0,0,0,0,0,WARM SPRINGS REHABILITATION HOSPITAL SAN ANTONIO,0.0,0,,,,,,No match,80.0,No,,BS&W TEXAS SPINE & JOINT HOSPITAL,55.4,Fuzzy name
Encompass Health Rehabilitation Hospital Of Arlington,453040,TX,0,0,0,0,0,0,0,0,0,0,0,ENCOMPASS HEALTH REHABILITATION HOSPITAL ARLINGTON,0.0,0,,,,,,No match,80.0,No,,USMD Hospital at Arlington LP,81.8,Fuzzy name
Encompass Health Rehabilitation Hospital Of City View,453042,TX,0,0,0,0,0,0,0,0,0,0,0,ENCOMPASS HEALTH REHABILITATION HOSPITAL CITY VIEW,0.0,0,,,,,,No match,80.0,No,,Texas Health Hospital Frisco,69.8,Fuzzy name
Encompass Health Rehabilitation Hospital Of Plano,453047,TX,0,0,0,0,0,0,0,0,0,0,0,ENCOMPASS HEALTH REHABILITATION HOSPITAL PLANO,0.0,0,,,,,,No match,80.0,No,,Texas Health Hospital Frisco,69.8,Fuzzy name
Pam Rehabilitation Hospital Of Beaumont,453048,TX,0,0,0,0,0,0,0,0,0,0,0,PAM REHABILITATION HOSPITAL BEAUMONT,0.0,0,,,,,,No match,81.0,No,,Midland Memorial Hospital,59.0,Fuzzy name
Encompass Health Rehabilitation Hospital Of Texarkana,453053,TX,0,0,0,0,0,0,0,0,0,0,0,ENCOMPASS HEALTH REHABILITATION HOSPITAL TEXARKANA,0.0,0,,,,,,No match,80.0,No,,Texas Health Hospital Frisco,69.8,Fuzzy name
Encompass Health Rehabilitation Hospital Of Wichita Falls,453054,TX,0,0,0,0,0,0,0,0,0,0,0,ENCOMPASS HEALTH REHABILITATION HOSPITAL WICHITA FALLS,0.0,0,,,,,,No match,80.0,No,,Texas Health Hospital Frisco,69.8,Fuzzy name
"Christus Trinity Mother Frances Rehabilitation Hospital, A Partner Of",453056,TX,0,0,0,0,0,0,0,0,0,0,0,CHRISTUS TRINITY MOTHER FRANCES REHABILITATION HOSPITAL A PARTNER,0.0,0,CHRISTUS MOTHER FRANCES HOSPITAL,TX,TYLER,4.0,CHRISTUS MOTHER FRANCES HOSPITAL,Exact/fuzzy hospital name,100.0,Review,BDC+,Christus Mother Frances Tyler,88.5,Fuzzy name
Encompass Health Rehabilitation Hospital Of Midland Odessa,453057,TX,0,0,0,0,0,0,0,0,0,0,0,ENCOMPASS HEALTH REHABILITATION HOSPITAL MIDLAND ODESSA,0.0,0,,,,,,No match,80.0,No,,Midland Memorial Hospital,78.0,Fuzzy name
Encompass Health Rehabilitation Hospital Of The Woodlands,453059,TX,0,0,0,0,0,0,0,0,0,0,0,ENCOMPASS HEALTH REHABILITATION HOSPITAL WOODLANDS,0.0,0,,,,,,No match,80.0,No,,Texas Health Hospital Frisco,69.8,Fuzzy name
Weslaco Regional Rehabilitation Hospital,453091,TX,0,0,0,0,0,0,0,0,0,0,0,WESLACO REGIONAL REHABILITATION HOSPITAL,0.0,0,,,,,,No match,87.2,No,,Texas Health Hospital Frisco,58.8,Fuzzy name
South Texas Rehabilitation Hospital,453092,TX,0,0,0,0,0,0,0,0,0,0,0,SOUTH TEXAS REHABILITATION HOSPITAL,0.0,0,SOUTH TEXAS HEALTH SYSTEM,TX,EDINBURG,4.0,SOUTH TEXAS,Exact/fuzzy hospital name,100.0,No,,TEXAS ORTHOPEDIC HOSPITAL,71.8,Fuzzy name
Vibra Rehabilitation Hospital Of Amarillo,453096,TX,0,0,0,0,0,0,0,0,0,0,0,VIBRA REHABILITATION HOSPITAL AMARILLO,0.0,0,,,,,,No match,84.2,No,,Texas Health Hospital Frisco,57.6,Fuzzy name
Covenant Children's Hospital,453306,TX,24799,23904,24955,24060,23852,25498,24007,24713,21335,21650,21466,COVENANT CHILDREN S HOSPITAL,23658.090909090908,11,COVENANT CHILDRENS HOSPITAL,TX,LUBBOCK,,COVENANT CHILDRENS HOSPITAL,CCN,,No,,MEMORIAL HERMANN SW HOSPITAL,60.7,Fuzzy name
"Healthbridge Children's Hospital - Houston, Ltd.",453309,TX,0,0,0,0,0,0,0,0,0,0,0,HEALTHBRIDGE CHILDREN S HOSPITAL HOUSTON LTD,0.0,0,HEALTHBRIDGE CHILDRENS'S HOSPITAL OF HOUSTON,TX,HOUSTON,,HEALTHBRIDGE CHILDRENS S HOSPITAL HOUSTON,CCN,,No,,HOUSTON METHODIST HOSPITAL,76.2,Fuzzy name
Texas Scottish Rite Hospital For Children,453314,TX,0,0,0,0,0,0,0,0,0,0,0,TEXAS SCOTTISH RITE HOSPITAL FOR CHILDREN,0.0,0,TEXAS SCOTTISH RITE HOSPITAL FOR CHILDREN,TX,DALLAS,,TEXAS SCOTTISH RITE HOSPITAL FOR CHILDREN,CCN,,No,,TEXAS ORTHOPEDIC HOSPITAL,71.8,Fuzzy name
University Dialysis West,453500,TX,5642,8175,8545,5932,8230,9097,7539,8845,8400,8505,8493,UNIVERSITY DIALYSIS WEST,7945.727272727273,11,UNIVERSITY HEALTH SYSTEM,TX,SAN ANTONIO,3.0,UNIVERSITY,Exact/fuzzy hospital name,100.0,No,,UT Southwestern University Hosp,61.8,Fuzzy name
Texas Health Fort Worth,459811,TX,35111,33735,35155,34548,36207,37425,0,36388,34557,34989,34942,TEXAS HEALTH FORT WORTH,32096.090909090908,10,TEXAS HEALTH HARRIS METHODIST FORT WORTH,TX,FORT WORTH,4.0,TEXAS HEALTH HARRIS METHODIST FORT WORTH,Exact/fuzzy hospital name,100.0,No,,Texas Health Hospital Frisco,70.6,Fuzzy name
Parkland Health,045015,TX,0,0,0,0,0,0,0,0,0,0,0,PARKLAND HEALTH,0.0,0,PARKLAND HEALTH & HOSPITAL SYSTEM,TX,DALLAS,3.0,PARKLAND HEALTH AND,Exact/fuzzy hospital name,100.0,No,,Texas Health Hospital Frisco,57.1,Fuzzy name
St Joseph Medical Center,045035,TX,11322,10881,11352,11131,11679,12085,11077,11733,11130,11274,11266,ST JOSEPH MED CTR,11357.272727272728,11,ST JOSEPH MEDICAL CENTER,TX,HOUSTON,3.0,ST JOSEPH MED CTR,Exact/fuzzy hospital name,100.0,No,,Texoma Medical Center,66.7,Fuzzy name
Jps Health Network,045039,TX,12060,11271,11689,11076,11380,12038,9089,10704,8361,8510,8631,JPS HEALTH NETWORK,10437.181818181818,11,JPS HEALTH NETWORK,TX,FORT WORTH,4.0,JPS HEALTH NETWORK,Exact/fuzzy hospital name,100.0,No,,Texas Health Hospital Frisco,50.0,Fuzzy name
Daughters Of Charity Health Services Of Waco/depaul Center,045042,TX,0,0,0,0,0,0,0,0,0,0,0,DAUGHTERS CHARITY HEALTH SERVICES WACO DEPAUL CENTER,0.0,0,,,,,,No match,63.2,No,,North Central Surgical Center,51.9,Fuzzy name
Northeast Baptist Hospital,045058,TX,14494,13926,14512,14262,14947,15449,14192,15022,14265,14444,14424,NORTHEAST BAPTIST HOSPITAL,14539.727272727272,11,,,,,,No match,81.8,No,,NORTH CENTRAL BAPTIST HOSPITAL,78.6,Fuzzy name
Pampa Regional Medical Center,045099,TX,8559,8225,8582,8415,8829,9136,8374,8870,8414,8523,8517,PAMPA REGIONAL MED CTR,8585.818181818182,11,PAMPA REGIONAL MEDICAL CENTER,TX,PAMPA,,PAMPA REGIONAL MED CTR,Exact/fuzzy hospital name,100.0,No,,Texoma Medical Center,66.7,Fuzzy name
Wadley Regional Medical Center,045200,TX,10625,10211,10653,10446,10960,11340,10395,11010,10445,10580,10572,WADLEY REGIONAL MED CTR,10657.90909090909,11,WADLEY REGIONAL MEDICAL CENTER,TX,TEXARKANA,,WADLEY REGIONAL MED CTR,Exact/fuzzy hospital name,100.0,No,,Texoma Medical Center,66.7,Fuzzy name
Harris Health - Ben Taub Psych,045289,TX,7976,7524,7852,8094,8055,7783,7762,8134,7628,7732,7671,HARRIS HEALTH BEN TAUB PSYCH,7837.363636363636,11,HARRIS HEALTH,TX,HOUSTON,3.0,HARRIS HEALTH,Exact/fuzzy hospital name,100.0,No,,TX Health Harris Meth Hosp SW Fw,63.4,Fuzzy name
Oakbend Medical Center,045330,TX,8823,8323,8686,8954,8910,8610,8586,8998,8439,8553,8486,OAKBEND MED CTR,8669.818181818182,11,OAKBEND MEDICAL CENTER,TX,RICHMOND,3.0,OAKBEND MED CTR,Exact/fuzzy hospital name,100.0,No,,HENDRICK MEDICAL CENTER,71.0,Fuzzy name
Baptist Beaumont Hospital,045346,TX,6145,5905,6161,6042,6339,6559,6012,6368,6041,6119,6115,BAPTIST BEAUMONT HOSPITAL,6164.181818181818,11,BAPTIST BEAUMONT HOSPITAL,TX,BEAUMONT,3.0,BAPTIST BEAUMONT HOSPITAL,Exact/fuzzy hospital name,100.0,No,,NORTH CENTRAL BAPTIST HOSPITAL,78.0,Fuzzy name
Medical City Behavioral Health Mckinney,045403,TX,14689,14159,14781,14251,14128,15103,14220,14638,14559,14774,14648,MEDICAL CITY BEHAVIORAL HEALTH MCKINNEY,14540.90909090909,11,,,,,,No match,85.0,No,,Medical City Dallas,77.4,Fuzzy name
Matagorda Regional Medical Center,045465,TX,4941,4776,5005,4991,4966,5210,4438,5088,4696,4597,4446,MATAGORDA REGIONAL MED CTR,4832.181818181818,11,MATAGORDA REGIONAL MEDICAL CENTER,TX,BAY CITY,5.0,MATAGORDA REGIONAL MED CTR,Exact/fuzzy hospital name,100.0,No,,Texoma Medical Center,66.7,Fuzzy name
Wilson N Jones Regional Medical Center,045469,TX,11360,10982,11508,11475,11419,11981,10204,11700,10798,10569,10222,WILSON N JONES REGIONAL MED CTR,11110.727272727272,11,WILSON N JONES REGIONAL MEDICAL CENTER,TX,SHERMAN,2.0,WILSON N JONES REGIONAL MED CTR,Exact/fuzzy hospital name,100.0,No,,Texoma Medical Center,66.7,Fuzzy name
The Medical Center Of Southeast Texas,045518,TX,8785,8443,8809,8637,9063,9377,8595,9104,4942,8226,9880,MED CTR SOUTHEAST TEXAS,8532.818181818182,11,THE MEDICAL CENTER OF SOUTHEAST TEXAS,TX,PORT ARTHUR,3.0,MED CTR SOUTHEAST TEXAS,Exact/fuzzy hospital name,100.0,No,,Texoma Medical Center,66.7,Fuzzy name
Texas Health Springwood Behavioral Health Hospital,045639,TX,35111,33735,35155,34548,36207,37425,0,36388,34557,34989,34942,TEXAS HEALTH SPRINGWOOD BEHAVIORAL HEALTH HOSPITAL,32096.090909090908,10,,,,,,No match,85.7,Review,BDC,Texas Health Hospital Frisco,85.7,Fuzzy name
"Scenic Mountain Medical Center, A Steward Family Hospital",045653,TX,9824,9441,9850,9659,10134,10485,9611,10180,9657,9782,9775,SCENIC MOUNTAIN MED CTR A STEWARD FAMILY HOSPITAL,9854.363636363636,11,MEDICAL CENTER HOSPITAL,TX,ODESSA,3.0,MED CTR HOSPITAL,Exact/fuzzy hospital name,100.0,No,,Texoma Medical Center,66.7,Fuzzy name
University Of Texas Health Science Center At Tyler,045690,TX,11527,11112,11600,11184,11087,11853,11159,11488,11426,11594,11496,UNIVERSITY TEXAS HEALTH SCIENCE CENTER TYLER,11411.454545454546,11,UNIVERSITY HEALTH SYSTEM,TX,SAN ANTONIO,3.0,UNIVERSITY,Exact/fuzzy hospital name,100.0,No,,Texas Health Hospital Frisco,60.0,Fuzzy name
Texas Health Presbyterian Hospital Plano,045771,TX,35111,33735,35155,34548,36207,37425,0,36388,34557,34989,34942,TEXAS HEALTH PRESBYTERIAN HOSPITAL PLANO,32096.090909090908,10,TEXAS HEALTH PRESBYTERIAN HOSPITAL PLANO,TX,PLANO,4.0,TEXAS HEALTH PRESBYTERIAN HOSPITAL PLANO,Exact/fuzzy hospital name,100.0,Review,BDC,Texas Health Hospital Frisco,85.7,Fuzzy name
Peterson Regional Medical Center,045007,TX,7344,7967,8268,7058,6965,7070,5928,6544,5874,5845,5606,PETERSON REGIONAL MED CTR,6769.909090909091,11,PETERSON REGIONAL MEDICAL CENTER,TX,KERRVILLE,4.0,PETERSON REGIONAL MED CTR,Exact/fuzzy hospital name,100.0,No,,Texoma Medical Center,66.7,Fuzzy name
Ut Southwestern University Hospital,045044,TX,20105,19316,20130,19782,20732,21430,19686,20836,19787,20035,20008,UT SOUTHWESTERN UNIVERSITY HOSPITAL,20167.909090909092,11,UT OF TEXAS  SOUTHWESTERN UNIVERSITY HOSPITAL - WILLIAM P. CLEMENTS JR.,TX,DALLAS,4.0,UT TEXAS SOUTHWESTERN UNIVERSITY HOSPITAL WILLIAM P CLEMENTS JR,Exact/fuzzy hospital name,100.0,Yes,BDC,UT Southwestern University Hosp,93.9,Fuzzy name
Chi St. Luke's Health Brazosport,045072,TX,10666,10250,10695,10487,11003,11385,10435,11053,10486,10621,10614,CHI ST LUKE S HEALTH BRAZOSPORT,10699.545454545454,11,CHI ST LUKE'S HEALTH BRAZOSPORT,TX,LAKE JACKSON,4.0,CHI ST LUKE S HEALTH BRAZOSPORT,Exact/fuzzy hospital name,100.0,No,,Chi St Lukes Hlth Baylor Coll Med,68.8,Fuzzy name
Baylor Scott & White Medical Center - Irving,045079,TX,11762,11762,11762,11762,11762,11762,11762,11762,11762,11762,11762,BAYLOR SCOTT AND WHITE MED CTR IRVING,11762.0,11,BAYLOR SCOTT & WHITE MEDICAL CENTER AT IRVING,TX,IRVING,5.0,BAYLOR SCOTT AND WHITE MED CTR IRVING,Exact/fuzzy hospital name,100.0,No,,Baylor University Medical Center,71.8,Fuzzy name
Titus Regional Medical Center,045080,TX,6167,6392,5887,6592,6524,6652,5150,5793,4216,4508,4335,TITUS REGIONAL MED CTR,5656.0,11,TITUS REGIONAL MEDICAL CENTER,TX,MOUNT PLEASANT,3.0,TITUS REGIONAL MED CTR,Exact/fuzzy hospital name,100.0,No,,Texoma Medical Center,66.7,Fuzzy name
Fort Duncan Regional Medical Center,045092,TX,10470,9877,10308,10626,10574,10218,10190,10679,10014,10150,10071,FORT DUNCAN REGIONAL MED CTR,10288.818181818182,11,FORT DUNCAN MEDICAL CENTER,TX,EAGLE PASS,3.0,FORT DUNCAN MED CTR,Exact/fuzzy hospital name,100.0,No,,Texoma Medical Center,66.7,Fuzzy name
Hca Houston Healthcare Southeast,045097,TX,14791,14211,14809,14554,15253,15765,14483,23460,14557,14739,14720,HCA HOUSTON HEALTHCARE SOUTHEAST,15576.545454545454,11,HCA HOUSTON HEALTHCARE SOUTHEAST,TX,PASADENA,3.0,HCA HOUSTON HEALTHCARE SOUTHEAST,Exact/fuzzy hospital name,100.0,No,,HOUSTON METHODIST WEST HOSPITAL,60.3,Fuzzy name
Baylor Scott & White Medical Center Hillcrest,045101,TX,11180,11180,11180,11180,11180,11180,11180,11180,11180,11180,11180,BAYLOR SCOTT AND WHITE MED CTR HILLCREST,11180.0,11,BAYLOR SCOTT & WHITE MEDICAL CENTER HILLCREST,TX,WACO,4.0,BAYLOR SCOTT AND WHITE MED CTR HILLCREST,Exact/fuzzy hospital name,100.0,No,,Baylor University Medical Center,71.8,Fuzzy name
Las Palmas Del Sol Healthcare,045107,TX,16511,15864,16531,16246,17026,17599,16167,17112,16250,16454,16431,LAS PALMAS DEL SOL HEALTHCARE,16562.81818181818,11,,,,,,No match,65.7,No,,Texas Health Hospital Frisco,49.1,Fuzzy name
South Texas Health System,045119,TX,9427,8893,9280,9567,9520,9199,9174,9614,9016,9139,9067,SOUTH TEXAS,9263.272727272728,11,SOUTH TEXAS HEALTH SYSTEM,TX,EDINBURG,4.0,SOUTH TEXAS,Exact/fuzzy hospital name,100.0,Yes,BDC+,SOUTH TEXAS SPINE & SURGICAL HOSP,100.0,Fuzzy name
Medical Center Hospital,045132,TX,8352,8026,8374,8211,8615,8914,8171,8655,8210,8316,8310,MED CTR HOSPITAL,8377.636363636364,11,MEDICAL CENTER HOSPITAL,TX,ODESSA,3.0,MED CTR HOSPITAL,Exact/fuzzy hospital name,100.0,No,,Bs&W Surgical Hospital Fort Worth,66.7,Fuzzy name
Detar Healthcare System,045147,TX,10238,10000,10101,10875,10252,10936,8767,9401,8005,7697,7635,DETAR,9446.09090909091,11,,,,,,No match,41.7,No,,Texoma Medical Center,31.6,Fuzzy name
Chi St. Luke's Health Baylor College Of Medicine Medical Center,045193,TX,14207,13653,14245,13968,14656,15164,13899,14723,13967,14147,14137,CHI ST LUKE S HEALTH BAYLOR COLLEGE MEDICINE MED CTR,14251.454545454546,11,,,,,,No match,85.0,No,,Chi St Lukes Hlth Baylor Coll Med,77.6,Fuzzy name
Northwest Healthcare System,045209,TX,11244,10607,11070,11411,11356,10973,10943,11468,10755,10901,10815,NORTHWEST,11049.363636363636,11,NORTHWEST TEXAS HOSPITAL,TX,AMARILLO,3.0,NORTHWEST TEXAS HOSPITAL,Exact/fuzzy hospital name,100.0,No,,Baylor University Medical Center,35.3,Fuzzy name
Chi St Luke's Health Memorial Lufkin,045211,TX,9763,9382,9789,9598,10071,10420,9551,10117,9597,9721,9714,CHI ST LUKE S HEALTH MEMORIAL LUFKIN,9793.0,11,CHI ST LUKES HEALTH MEMORIAL LUFKIN,TX,LUFKIN,2.0,CHI ST LUKES HEALTH MEMORIAL LUFKIN,Exact/fuzzy hospital name,98.6,No,,TX Health Arlington Memorial Hosp,66.7,Fuzzy name
Baptist St. Anthony's Hospital,045231,TX,11851,11389,11883,11652,12225,12649,11594,12281,11650,11801,11793,BAPTIST ST ANTHONY S HOSPITAL,11888.0,11,,,,,,No match,80.0,No,,NORTH CENTRAL BAPTIST HOSPITAL,71.2,Fuzzy name
Reba Mcentire Center For Rehabilitation,045324,TX,14135,13334,13915,14345,14275,13794,13756,14416,13519,13703,13595,REBA MCENTIRE CENTER FOR REHABILITATION,13889.727272727272,11,,,,,,No match,52.9,No,,North Central Surgical Center,52.9,Fuzzy name
Huntsville Memorial Hospital,045347,TX,9366,9001,9391,9209,9662,9997,9163,9706,9208,9327,9320,HUNTSVILLE MEMORIAL HOSPITAL,9395.454545454546,11,MEMORIAL HOSPITAL,TX,GONZALES,,MEMORIAL HOSPITAL,Exact/fuzzy hospital name,100.0,No,,Midland Memorial Hospital,81.0,Fuzzy name
Hunt Regional Healthcare,045352,TX,5642,6881,7184,5932,6866,7340,6911,7114,7076,7180,7119,HUNT REGIONAL HEALTHCARE,6840.454545454545,11,,,,,,No match,76.5,No,,TX Health Presby Hosp Rockwall,51.9,Fuzzy name
Houston Methodist Hospital,045358,TX,17137,16469,17183,16849,17678,18291,16766,17759,16847,17065,17052,HOUSTON METHODIST HOSPITAL,17190.545454545456,11,HOUSTON METHODIST HOSPITAL,TX,HOUSTON,5.0,HOUSTON METHODIST HOSPITAL,Exact/fuzzy hospital name,100.0,Yes,BDC,HOUSTON METHODIST HOSPITAL,100.0,Exact normalized name
St David's Medical Center,045431,TX,15453,14847,15473,15206,15936,16472,15131,16016,15209,15400,15379,ST DAVID S MED CTR,15502.0,11,ST DAVID'S MEDICAL CENTER,TX,AUSTIN,4.0,ST DAVID S MED CTR,Exact/fuzzy hospital name,100.0,No,,BS&W MEDICAL CENTER FRISCO,68.3,Fuzzy name
Texas Health Presbyterian Hospital Dallas,045462,TX,35111,33735,35155,34548,36207,37425,0,36388,34557,34989,34942,TEXAS HEALTH PRESBYTERIAN HOSPITAL DALLAS,32096.090909090908,10,TEXAS HEALTH PRESBYTERIAN HOSPITAL DALLAS,TX,DALLAS,4.0,TEXAS HEALTH PRESBYTERIAN HOSPITAL DALLAS,Exact/fuzzy hospital name,100.0,Review,BDC,Texas Health Hospital Frisco,85.7,Fuzzy name
Cecil R. Bomar Rehabilitation Center,045508,TX,4514,8013,8365,4745,7995,8547,6031,8284,8239,8361,8290,CECIL R BOMAR REHABILITATION CENTER,7398.545454545455,11,,,,,,No match,59.4,No,,Ascension Seton Med Center Austin,50.0,Fuzzy name
Baylor Scott & White Medical Center - Grapevine,045563,TX,11762,11762,11762,11762,11762,11762,11762,11762,11762,11762,11762,BAYLOR SCOTT AND WHITE MED CTR GRAPEVINE,11762.0,11,BAYLOR SCOTT & WHITE MEDICAL CENTER  GRAPEVINE,TX,GRAPEVINE,4.0,BAYLOR SCOTT AND WHITE MED CTR GRAPEVINE,Exact/fuzzy hospital name,100.0,No,,Baylor University Medical Center,71.8,Fuzzy name
Hca Houston Healthcare Clear Lake,045617,TX,12580,12087,12596,12379,12973,13409,12318,19202,12382,12537,12520,HCA HOUSTON HEALTHCARE CLEAR LAKE,13180.272727272728,11,HCA HOUSTON HEALTHCARE CLEAR LAKE,TX,WEBSTER,4.0,HCA HOUSTON HEALTHCARE CLEAR LAKE,Exact/fuzzy hospital name,100.0,No,,Texas Health Hospital Frisco,52.5,Fuzzy name
